MIS,KI,2024,Podnikový management a IS,Podnikový management a informační systémy,A,A,N,K,"",5,NE,"","'RNDr. Jiří Škvor, Ph.D.'","'RNDr. Jiří Škvor, Ph.D.' (100)",2220,"'RNDr. Jiří Škvor, Ph.D.', 'Ing. Štěpánka Zimová'","'RNDr. Jiří Škvor, Ph.D.' (100), 'Ing. Štěpánka Zimová' (100)","2220, 7352","'Ing. Pavel Kuba, Ph.D.'","'Ing. Pavel Kuba, Ph.D.' (100)",2317,"","","","","","","","","",KI/FIS,"'SYNEK, M. Manažerská ekonomika. Praha: Grada, 2007. ISBN 978-80-247-1992-4.',
'Synek M. a kol. Podniková ekonomika. C. H. Beck, Praha, 2006. ISBN 80-7179-892-4.',
'Schelle K. Právo pro ekonomy. Key Publishing, Ostrava, 2011. ISBN 978-80-7418-115-3.',
'Spirit M. Základy práva pro neprávníky. Vydavatelství a naklad. Aleš Čeněk, Plzeň, 2012. ISBN 978-80-7380-391-9.',
'Kislingerová E. Inovace nástrojů ekonomiky a managementu organizací. C. H. Beck, Praha, 2008. ISBN 978-80-7179-882-8.',
'Švarc Z. Základy obchodního práva. Vydavatelství a nakladatelství Aleš Čeněk, Plzeň, 2011. ISBN 978-80-7380-322-3.',
'Mates P. Základy teorie práva. Oeconomica, Praha, 2009. ISBN 978-80-245-1566-3.'","","Monologická (výklad, přednáška, instruktáž), Pozorování, Demonstrace",Známkou,N,2,HOD/TYD,2,HOD/TYD,0,HOD/TYD,"Cílem přednášek je poskytnout studentům přehled o principech, které ovlivňují především podnikatelské prostředí, fungování a vztahy právnických a fyzických osob. Způsob výstavby společnosti, její ekonomické fungování s důrazem na základní principy účetnictví, výkaznictví a důležitých indexů tvořící základ fungování současných informačních systémů.Cílem seminářů je objasnění základních stavebních prvků podniku, jeho financování, řízení, získávání informací o jeho okolí. Součástí semináře je i úvod do problematiky standardizace v oblasti informatiky.",Zkouška,ANO,Kombinovaná,"","1. Podnik a podnikání, efektivnost podniku a její základní kategorie, cíle podniku a jeho funkce
2. Management a jeho funkce, rozhodování, plánování, organizace, koordinace
3. Řízení lidských zdrojů, výrobní a nákupní činnosti podniku, financování podniku
4. Obecný úvod do právního systému (základní pojmy práva, dělba moci, organizace výkonu práva a síla právní normy)
5. Živnostenský zákon (definice živnosti, rozdělení živností, podmínky provozování živností, druhy živností, živnostenský rejstřík, živnostenské oprávnění)
6. Občanský zákoník (rozsah působnosti, vymezení pojmů, struktura a vybrané části obč. zák.)
7. Zákoník práce (předmět úpravy ZP, účastníci pracovně právních vztahů, kolektivní smlouva, pracovní poměr, pracovní smlouva, změny pracovního poměru, skončení pracovního poměru, dohody o pracích konaných mimo pracovní poměr, pracovní doba a doba odpočinku, odměňování za práci, poskytování cestovních náhrad)
8. Majetková a kapitálová výstavba podniku, zdroje financování
9. Organizační struktura podniku, podnikové řízení, firemní kultura
10. Investiční činnost a podnikové početnictví
11. Zdroje informací o právních normách, podnikatelský plán
12. Okolí společnosti a využití metod Competitive Intelligence
13. Standardy v oblasti informačních systémů","","","","",Čeština,"",A,N,N,"","","",A,N,"",0,"",Bc.,A,"",ZS,0,"","","",0,0,0
NME,KI,2024,Numerické metody,Numerické metody,A,A,N,K,"",5,NE,"","'doc. Ing. Mgr. Jiří Barilla, CSc.'","'doc. Ing. Mgr. Jiří Barilla, CSc.'",449,"'doc. Ing. Mgr. Jiří Barilla, CSc.', 'RNDr. Petr Kubera, Ph.D.', 'RNDr. Jiří Škvor, Ph.D.'","'doc. Ing. Mgr. Jiří Barilla, CSc.' (100), 'RNDr. Petr Kubera, Ph.D.' (100), 'RNDr. Jiří Škvor, Ph.D.' (100)","449, 650, 2220","'RNDr. Petr Kubera, Ph.D.', 'Mgr. Květuše Sýkorová', 'RNDr. Jiří Škvor, Ph.D.'","'RNDr. Petr Kubera, Ph.D.' (100), 'Mgr. Květuše Sýkorová' (100), 'RNDr. Jiří Škvor, Ph.D.' (100)","650, 835, 2220","","","","","","","","KMA/P110, KMA/P136","","","'Felcman J. Numerická matematika. 2013. ',
'Segethova, J. Základy numerické matematiky. Karolinum, Praha. ',
'Mathematics. Springer, Berlin. ISBN 0-387-98959-5.',
'Ueberhuber, W. Numerical Computation 1, 2: Methods, Software, and Analysis. Springer, Berlin. ',
'Quarteroni, A., Sacco, R., and Saleri, F. Numerical Mathematics (2ndedn), Volume 37 of Texts in Applied Mathematics. Springer, Berlin. ISBN 0-387-98959-5. '","","","",N,2,HOD/TYD,2,HOD/TYD,0,HOD/TYD,Základní kurs numerické matematiky pro informatiky.,Zkouška,ANO,Kombinovaná,"Požadavky pro udělení zápočtu
- aktivní účast na seminářích (povoleny jsou nejvýše 3 absence)
- prezentace řešení vybraných úloh ve vhodném programovacím jazyce a jejich vysvětlení

Zkouška je ústní a proběhne v časovém rozsahu zhruba 30 minut. Prověřovány jsou teoretické znalosti a schopnost popisu, rozboru a odvození vybraných algoritmů.
","1.	Aproximace funkcí v R, Lagrangeův interpolační polynom, chyba Lagrangeovy interpolace. 
2.	Kubický spline, konstrukce přirozeného kubického spline. 
3.	Numerická integrace funkcí, Newtonovy-Cotesovy vzorce, složené Newtonovy-Cotesovy vzorce. 
4.	Rombergova kvadratura, Gaussova kvadratura. 
5.	Metody řešení nelineárních rovnic, Newtonova metoda, důkaz konvergence Newtonovy metody. 
6.	Metoda postupných aproximací pro nelineární rovnice, kořeny polynomu, Hornerovo schéma. 
7.	Soustavy lineárních rovnic, podmíněnost matic, Gaussova eliminace, pivotace, Gaussova eliminace jako faktorizační metoda. 
8.	LU rozklad, vliv zaokrouhlovacích chyb, Choleského rozklad, QR rozklad. 
9.	Iterační metody řešení soustav lineárních algebraických rovnic, klasické iterační metody. 
10.	Výpočet vlastních čísel matic, mocninná metoda. 
11.	Numerická integrace obyčejných diferenciálních rovnic, jednokrokové metody, metody typu Runge-Kutta, Rungeova-Kuttova metoda 2. řádu. 
12.	Gradientní metody.",Výuka v angličtině je určena pro erasmové a zahraniční studenty. Výuka v případě malého počtu studentů probíhá formou individuálních konzultací.,"","","","Čeština, Angličtina",Výuka v anglickém jazyce je určena výhradně studentům přijíždějícím v rámci programu Erasmus.,A,N,N,"","","",A,N,"",0,"",Bc.,A,"",ZS,0,"","","",0,0,0
NUM,KI,2024,Numerické metody,Numerické metody,A,A,N,K,"",2,NE,"","'doc. Ing. Mgr. Jiří Barilla, CSc.'","'doc. Ing. Mgr. Jiří Barilla, CSc.'",449,"","","","","","","'doc. Ing. Mgr. Jiří Barilla, CSc.', 'RNDr. Jiří Škvor, Ph.D.'","'doc. Ing. Mgr. Jiří Barilla, CSc.' (100), 'RNDr. Jiří Škvor, Ph.D.' (100)","449, 2220","","","","","KI/APR1, KMA/MA1, KMA/MT1","","","'Vicher, M. Numerická matematika, skripta UJEP, Ústí n. Lab., 2003. ',
'VONDRÁK, V. a L. POSPÍŠIL. Numerické metody 1. 2011. ',
'KUBEN, J. a P. RAČKOVÁ. Numerické metody. Brno: Univerzita obrany, 2016. ISBN 978-80-7231-373-0.'","","","",N,0,HOD/TYD,0,HOD/TYD,2,HOD/TYD,"V předmětu jsou studentům představeny základní metody numerické matematiky a možnosti jejich použití v praxi.
Studenti si osvojí nezbytné teoretické znalosti (schopnost popisu, rozboru a odvození vybraných algoritmů), které spolu
s praktickými dovednostmi nabytými v předmětu Matematický software využijí k řešení komplexnějších úloh z praxe.
Hlavním cílem předmětu je rozšířit kompetence studentů v oblasti programování v Pythonu či R za použití algoritmů
numerické matematiky a ukázat jejich aplikace. Dalším cílem předmětu je, aby studenti dokázali zvolit vhodnou metodu
pro řešení zadaného problému.",Zápočet,NE,Kombinovaná,Seminární práce,"1. Vlastnosti numerických algoritmů: stabilita, korektnost a podmíněnost úlohy, typy chyb a jejich šíření
2. - 3. Řešení nelineárních rovnic: metoda půlení intervalu, regula falsi, metoda prostých iterací, Newtonova metoda tečen, Hornerovo schéma a kořeny polynomu (Newtonova-Hornerova metoda)
4. - 5. Řešení soustav lineárních rovnic: přímé metody (Gaussova eliminační metoda, metoda LU rozkladu), iterační metody (Jacobiova, Gaussova-Seidelova)
6. - 7. Interpolace: po částech lineární a polynomem (v Lagrangově a Newtonově tvaru)
8. - 9. Aproximace metodou nejmenších čtverců
10. - 11. Numerické derivování a integrace (Newtonovy-Cotesovy vzorce jednoduché a složené, Rombergova kvadratura)
12. - 13. Numerické řešení obyčejných diferenciálních rovnic: jednokrokové metody (Eulerova metoda, metody Rungeho-Kutty","","","","",Čeština,"",A,N,N,"","","",A,N,"",0,"",Bc.,A,0,ZS,0,"","","",0,0,0
PDSA,KI,2024,Pokročilé datové struktury a algoritmy,Pokročilé datové struktury a algoritmy,A,A,N,K,"",5,NE,"","'doc. RNDr. Mgr. Viktor Maškov, DrSc.'","'doc. RNDr. Mgr. Viktor Maškov, DrSc.'",2239,"'Mgr. Jiří Fišer, Ph.D.', 'doc. RNDr. Mgr. Viktor Maškov, DrSc.', 'RNDr. Jiří Škvor, Ph.D.'","'Mgr. Jiří Fišer, Ph.D.' (100), 'doc. RNDr. Mgr. Viktor Maškov, DrSc.' (100), 'RNDr. Jiří Škvor, Ph.D.' (100)","251, 2239, 2220","'Mgr. Jiří Fišer, Ph.D.', 'Mgr. Květuše Sýkorová', 'RNDr. Jiří Škvor, Ph.D.'","'Mgr. Jiří Fišer, Ph.D.' (100), 'Mgr. Květuše Sýkorová' (100), 'RNDr. Jiří Škvor, Ph.D.' (100)","251, 835, 2220","","","","","","","","","",KI/PAR,"","","","",N,2,HOD/TYD,2,HOD/TYD,0,HOD/TYD,"Předmět je zaměřen na teoretické i praktické seznámení s běžně používanými datovými strukturami a algoritmy nad těmito strukturami. Předmět je zahájen přednáškou, která je věnována formalismu asymptotické složitosti a optimálnímu využívání počítačové paměti. Následuje popis základních i pokročilých datových struktur včetně elementárních operací nad nimi (vkládání, vyhledávání, vymazání). Nejrozsáhlejší část předmětu je věnována třem základním algoritmickým přístupům (rekurzivní algoritmy, hladové algoritmy a pravděpodobnostní algoritmy) s příklady běžně používaných obecných algoritmů. Poslední část předmětu je věnována stručnému přehledu a prezentaci algoritmů a datových struktur v oblastech, u nichž se předpokládá aplikace v rámci semestrálních projektů.",Zkouška,ANO,Kombinovaná,"Forma způsobu ověření studijních výsledků a další požadavky na studenta	Zápočet: seminární práce (implementace netriviální datové struktury či algoritmu)
Zkouška: ústní, zaměřená na praktické využití algoritmů a datových struktur

","Přednášky se zaměřují na formální popis algoritmů a příklady jejich uplatnění v praxi (přednášky v poslední části předmětu jsou vedeny či připraveny vyučujícími, kteří příslušné algoritmy využívají v rámci svých vědeckých či odborných aktivit). V průběhu cvičení jsou jednotlivé algoritmy implementovány, či je diskutována jejich implementace ve standardních knihovnách (srovnání efektivity implementace) a je naznačeno jejich praktické využití.
1.	Teoretické základy algoritmizace: asymptotická složitost (Landauovy asymptotické notace), princip lokality (důsledky pro mezipaměti)
2.	Datové struktury: základní principy, lineární datové struktury, hashovací tabulky (hashovací funkce), řídká pole
3.	Datové struktury: stromové struktury (binární uspořádané stromy, haldy), vyvažování stromů
4.	Datové struktury: grafy (Fibonacciho haldy, ohodnocené grafy)
5.	Rekurzivní algoritmy: rozděl a panuj (quick sort, merge sort, nejbližší dvojice bodů)
6.	Rekurzivní algoritmy: dynamické programování
7.	Hladové algoritmy: deterministické hladové algoritmy (např. hledání kostry grafu)
8.	Hladové algoritmy: heuristiky (problém obchodního cestujícího)
9.	Pravděpodobnostní algoritmy: generátory pseudonáhodných čísel, randomizované datové struktury a klasické algoritmy, Monte Carlo metody
10.	Výpočetní geometrie: konvexní obálka, Delaunayova triangulace, Voroného diagram
11.	Výpočetní geometrie: BSP tree, quadtree/octree a R-tree, Minkowského suma a její uplatnění
12.	Shluková analýza: hierarchické shlukování, hustotní shlukování (DBSCAN), centroidní shlukování (k means), grafové algoritmy (kliky)
13.	Zpracování textů (suffix trees, string distance, approximate pattern matching)
","","","","",Čeština,"",A,N,N,"","","",A,N,"",0,"",Mgr.,A,0,ZS,0,"","","",0,0,0
PNUM,KI,2024,Pokročilé numerické metody,Pokročilé numerické metody,A,A,N,K,"",5,NE,"","'doc. Ing. Mgr. Jiří Barilla, CSc.'","'doc. Ing. Mgr. Jiří Barilla, CSc.'",449,"'doc. Ing. Mgr. Jiří Barilla, CSc.', 'RNDr. Petr Kubera, Ph.D.'","'doc. Ing. Mgr. Jiří Barilla, CSc.' (100), 'RNDr. Petr Kubera, Ph.D.' (100)","449, 650","'RNDr. Petr Kubera, Ph.D.', 'RNDr. Jiří Škvor, Ph.D.'","'RNDr. Petr Kubera, Ph.D.' (100), 'RNDr. Jiří Škvor, Ph.D.' (100)","650, 2220","","","","","","","","","","","","","","",N,2,HOD/TYD,2,HOD/TYD,0,HOD/TYD,"Tento předmět nabízí studentům ucelený přehled metod numerické matematiky. Předmět dále rozvíjí znalosti a dovednosti z oblasti numerických metod, které by měli studenti získat v bakalářském studiu. Poskytuje hlubší vhled do problematiky a akcentuje metody numerické lineární algebry jakožto nástroje pro datovou analýzu a strojové učení. Studenti si osvojí jak teoretické znalosti, tak i praktické aplikace v rámci cvičení za použití volně dostupných knihoven pro Python a R.",Zkouška,ANO,Kombinovaná,"Zápočet: praktický test (řešení zadané úlohy na počítači v počítačové učebně)
Zkouška: ústní, zaměřená na ověření teoretických znalostí
","1. Stabilita, zdroje zaokrouhlovacích chyb a jejich vliv
2. - 3. Přímé metody pro řešení lineárních rovnic: GEM, LU rozklad, Choleského faktorizace, QR faktorizace a jejich aplikace
4. - 5. Iterační metody pro řešení lineárních rovnic: Jacobiova, Gaussova-Seidelova metoda, SOR, gradientní metoda a metoda sdružených gradientů
6. - 7. Vlastní čísla a jejich výpočet: odhady vlastních čísel, částečný problém vlastních čísel (mocninná metoda), úplný problém vlastních čísel (QR iterace a konstrukce QR rozkladu)
8. SVD rozklad, jeho výpočet a aplikace
9. Iterační metody řešení nelineárních rovnic a jejich soustav: Newtonova metoda a její varianty, metoda prosté iterace, metody pevného bodu a jejich konvergence
10. Hledání kořenů polynomů: odhady kořenů polynomů, Newtonova-Hornerova metoda, Mullerova metoda, Bernoulliova metoda
11. Numerická kvadratura: zopakování základních metod pro jednorozměrné integrály (Newtonovy-Cotesovy vzorce), Gaussova kvadratura, výpočet nevlastních integrálů, adaptivní přístupy, redukce pro vícerozměrné integrály a metoda Monte Carlo
12. Řešení ODR a jejich soustav: jednokrokové a vícekrokové metody, metody prediktor-korektor, metody Rungeho-Kutty, stiff problémy a stabilita metod
13. Aproximace a interpolace funkcí: zopakování základních metod (interpolace polynomem aj.), kubický spline, Čebyševovská aproximace
","","","","",Čeština,"",A,N,N,"","","",A,N,"",0,"",Mgr.,A,0,ZS,0,"","","",0,0,0
PRAX,KI,2024,Odborná praxe,Odborná praxe,A,A,A,K,"",4,NE,"","'RNDr. Jan Krejčí, Ph.D.'","'RNDr. Jan Krejčí, Ph.D.' (100)",2776,"","","","","","","'RNDr. Jan Krejčí, Ph.D.', 'RNDr. Jiří Škvor, Ph.D.'","'RNDr. Jan Krejčí, Ph.D.' (100), 'RNDr. Jiří Škvor, Ph.D.' (100)","2776, 2220","","","","","","","","","","","",N,0,HOD/TYD,0,HOD/TYD,7,DNU/SEM,"Odbornou praxi vykonají studenti ve firmách zaměřených na oblast informatiky a počítačových technologií resp. v informaticky zaměřených odborech státní správy, a to pokud možno v rámci Ústeckého kraje. Primárně budou studentům nabízeny firmy, s nimiž máme dlouhodobější spolupráci, student si však může vybrat i další firmy, ty však musí být schváleny garantem předmětu (ještě před započetím praxe a podpisem smlouvy s danou firmou).

Alternativně lze předmět absolvovat i zahraničním studijním pobytem v rámci projektu Erasmus resp. aktivní spoluprací na vědeckých projektech jiných kateder Přírodovědecké fakulty či jiných fakult UJEP (opět se schválením garanta předmětu).

Rozsah praxe musí být minimálně 7 pracovních dnů a praxe může být absolvována nejdříve po skončení výuky v letním semestru druhého roku studia (optimálně ve zkouškovém období). Praxe musí být zakončena stručnou závěrečnou zprávou potvrzenou odpovědnou osobou z firmy či organizace, jež praxi poskytla (odpovědná osoba je stanovena garantem předmětu a specifikována ve smlouvě o poskytnutí praxe). Na základě této zprávy udělí garant předmětu zápočet.

Cílem odborné praxe je nejen prohloubení praktických odborných znalostí, ale i zlepšení schopnosti adaptace studentů na pracovní prostředí (procesní úkony, organizace práce).",Zápočet,NE,Kombinovaná,"","","","","","",Čeština,"",A,N,N,"","","",A,A,"",0,"",Bc.,A,"",ZS,0,"","","",0,0,0
PROJ,KI,2024,Projektový seminář,Projektový seminář,A,A,N,K,"",5,NE,"","'Mgr. Jiří Fišer, Ph.D.'","'Mgr. Jiří Fišer, Ph.D.' (100)",251,"","","","","","","'Mgr. Jiří Fišer, Ph.D.', 'RNDr. Jan Krejčí, Ph.D.', 'doc. RNDr. Zbyšek Posel, Ph.D.', 'RNDr. Jiří Škvor, Ph.D.'","'Mgr. Jiří Fišer, Ph.D.' (100), 'RNDr. Jan Krejčí, Ph.D.' (100), 'doc. RNDr. Zbyšek Posel, Ph.D.' (100), 'RNDr. Jiří Škvor, Ph.D.' (100)","251, 2776, 3521, 2220","","","","",KI/FIS,"","","'DVOŘÁK D., SIRŮČEK J., KALIŠ J.: . Mistrovství v Microsoft Project 2010. Praha, 2011. ISBN 9788025130742.',
'SCHWALBE K.: . Řízení projektů v IT. Praha, 2011. ISBN 9788025130759.',
'Taylor J. Začínáme řídit projekty. Computer Press, Praha, 2007. ISBN 978-80-251-1759-0.',
'SVOZILOVÁ A.: . Projektový management 2. Praha, 2011. ISBN 978-80-247-3611-2.',
'DVOŘÁK D., MAREČEK M., RÉPAL M.: . Řízení portfolia projektů. Praha, 2011. ISBN 9788025130759.',
'BARBEE D.: . 97 klíčových znalostí projektového manažera. Praha, 2010. ISBN 9788025128541.'","","","",N,0,HOD/TYD,0,HOD/TYD,2,HOD/TYD,"V rámci projektového semináře se studenti seskupují do menších (3-5 členných) týmů a navrhují projekt menšího rozsahu a tento projekt implementují.

Témata projektů určují vyučujících jednotlivých odborných předmětů, přičemž projekt může spojovat i problematiku více kurzů či dokonce specializačních modulů (např. webová služba pro firemní IS s implementací softwarové části a návrhem hardwarového nasazení).

V projektovém semináři studenti mj. procvičují a prohlubují znalosti získané z předcházejícího kurzu Projektové řízení a firemní informační systémy.

Jednotlivé projekty budou průběžně monitorovány na seminářích, které navíc poskytují možnost vzájemné výměny informací i mezi jednotlivými týmy.

Hodnocen nebude jen výsledný produkt, ale i projektová dokumentace obsahující analýzu, návrh, časový plán apod. resp. dlouhodobější udržitelnost projektu (flexibilita, rozšiřitelnost, technická dokumentace).",Zkouška,ANO,Kombinovaná,"Prezentace zadání a cílů projektu, průběhu jeho řešení (technická a organizační stránka) a jeho výstupu","","","","","",Čeština,"",A,N,N,"","","",A,N,"",0,"",Bc.,A,"",ZS,0,"","","",0,0,0
PS1,KI,2024,Projektový seminář I,Projektový seminář I,A,A,N,K,"",4,NE,"","'RNDr. Jiří Škvor, Ph.D.'","'RNDr. Jiří Škvor, Ph.D.'",2220,"","","","","","","'RNDr. Jiří Škvor, Ph.D.'","'RNDr. Jiří Škvor, Ph.D.' (100)",2220,"","","","","","",KI/PS2,"","","","",N,0,HOD/TYD,0,HOD/TYD,2,HOD/TYD,"",Zápočet,NE,Kombinovaná,"","","","","","",Čeština,"",A,N,N,"","","",A,N,"",0,"",Bc.,A,0,ZS,0,"","","",0,0,0
PVS,KI,2024,Projektové výzvy a strategie v IT,Projektové výzvy a strategie v IT,A,A,N,K,"",2,NE,"","'RNDr. Jiří Škvor, Ph.D.'","'RNDr. Jiří Škvor, Ph.D.'",2220,"","","","","","","'RNDr. Jiří Škvor, Ph.D.'","'RNDr. Jiří Škvor, Ph.D.' (100)",2220,"","","","","","","","","","","",N,0,HOD/TYD,0,HOD/TYD,2,HOD/TYD,"V rámci předmětu představí odborníci z firem, organizací a institucí typu ICUK, TAČR, MŠMT, MPO, NCP 4.0 či NÚKIB různé národní a mezinárodní projektové výzvy a strategie související s IT typu Národní strategie umělé inteligence v České republice, Národní RIS3 strategie apod.",Zápočet,NE,Kombinovaná,"Aktivní účast, kontrolní písemný test na konci každého semináře","","","","","",Čeština,"",A,N,N,"","","",A,N,"",0,"",Mgr.,A,0,ZS,0,"","","",0,0,0
PYR,KI,2024,Python and R for Data Science,Python and R for Data Science,A,A,N,K,"",4,NE,"","'RNDr. Jiří Škvor, Ph.D.'","'RNDr. Jiří Škvor, Ph.D.'",2220,"'prof. Sergii Babichev, DSc.', 'RNDr. Jiří Škvára, Ph.D.', 'RNDr. Jiří Škvor, Ph.D.'","'prof. Sergii Babichev, DSc.' (100), 'RNDr. Jiří Škvára, Ph.D.' (100), 'RNDr. Jiří Škvor, Ph.D.' (100)","3416, 6259, 2220","'prof. Sergii Babichev, DSc.', 'RNDr. Jiří Škvára, Ph.D.', 'RNDr. Jiří Škvor, Ph.D.'","'prof. Sergii Babichev, DSc.' (100), 'RNDr. Jiří Škvára, Ph.D.' (100), 'RNDr. Jiří Škvor, Ph.D.' (100)","3416, 6259, 2220","","","","","","","","","","KI/ASO1, KI/CRS, KI/SOC","","","","",N,1,HOD/TYD,2,HOD/TYD,0,HOD/TYD,"V předmětu studenti prakticky rozvinou základní dovednosti v programovacích jazycích Python a R v oblastech stěžejních pro datové inženýry a vědce. Různé metody a techniky zpracování, analýzy a vizualizace dat si studenti osvojí ryze prakticky na vzorových řešeních, tj. na aplikační a interpretační úrovni, bez nutnosti hlubších znalostí principů těchto metod a technik, které by měli nabýt v předchozím, případně dalším studiu. Výraznou součástí výuky je práce studentů ve skupinách na řešení případových studií (""inspirovaných daty"") menšího rozsahu, jejich prezentace a vzájemné kritické zhodnocení. Zdrojem dat a inspirací jsou platformy typu kaggle.com. Ve výuce se uplatní materiály výukových platforem jako je datacamp.com, které jsou jinak doporučeny zejména k samostudiu a získání certifikátů",Zkouška,ANO,Kombinovaná,"Zápočet: seminární práce
Zkouška: ústní
","1. Prohloubení základů syntaxe a základních konstrukcí jazyků Python a R
2. Základy práce s daty a datovými soubory a jejich vizualizace
3. Pokročilé techniky práce s daty a datovými soubory (import, čištění dat aj.)
4. Pokročilé techniky vizualizace dat
5. - 6. Explorační analýza dat, vybrané pokročilé statistické metody (korelační, regresní analýza, faktorová, shluková analýza aj.), inferenční statistika
7. - 8. Základní aplikace metod strojového učení (vybrané klasifikátory či algoritmy pro regresi a shlukování)
9. Základy textové analýzy, analýza sentimentu
10. Analýza sítí
11. - 12. Reporty, dashboardy a interaktivní vizualizace dat
13. Shrnutí, diskuse nad zadáními seminárních prací
","","","","",Angličtina,"",A,N,N,"","","",A,N,"",0,"",Mgr.,A,0,ZS,0,"","","",0,0,0
SP1,KI,2024,Semestrální projekt I,Semestrální projekt I,A,A,N,K,"",2,NE,"","'doc. RNDr. Zbyšek Posel, Ph.D.'","'doc. RNDr. Zbyšek Posel, Ph.D.'",3521,"","","","","","","'Mgr. Jiří Fišer, Ph.D.', 'RNDr. Jan Krejčí, Ph.D.', 'RNDr. Petr Kubera, Ph.D.', 'doc. RNDr. Zbyšek Posel, Ph.D.', 'RNDr. Jiří Škvor, Ph.D.'","'Mgr. Jiří Fišer, Ph.D.' (100), 'RNDr. Jan Krejčí, Ph.D.' (100), 'RNDr. Petr Kubera, Ph.D.' (100), 'doc. RNDr. Zbyšek Posel, Ph.D.' (100), 'RNDr. Jiří Škvor, Ph.D.' (100)","251, 2776, 650, 3521, 2220","","","","","","",KI/SP2,"","","","",N,0,HOD/TYD,0,HOD/TYD,2,HOD/TYD,"Tento předmět zahajuje sérii tří na sebe navazujících předmětů, v jejichž průběhu se studenti aktivně zapojí do projektů řešených ve spolupráci s firmami (zejména projektů smluvního výzkumu), případně jiných výzkumných projektů zejména aplikačního charakteru, na jejichž řešení se podílí členové katedry. Počet míst na jeden projekt bude omezený tak, aby rozdělení studentů pokrylo potřeby aktuálně řešených či připravovaných projektů",Zápočet,NE,Kombinovaná,"Účast na projektových schůzkách, průběžné plnění zadaných úkolů
Zápočet uděluje řešitel projektu.
","V této fázi se předpokládá postupné provádění těchto činností:
- představení řešených/připravovaných projektů,
- začlenění studentů do jednotlivých projektových týmů (na základě jejich odborných znalostí/dovedností/kompetencí a preferencí), stanovení rolí v projektových týmech (na základě týmových kompetencí),
- seznámení se s nástroji týmové spolupráce a jejich konfigurace na straně nových členů týmů,
- návrh realizace nového projektu nebo předávání know-how (u běžících projektů),
- (samo)studium faktických znalostí a získávání technologických dovedností spojených s realizací projektu,
- stanovení prvních dílčích úkolů pro nové členy týmu,
- počáteční řešení dílčích úkolů.

Cílem dílčích úkolů je jednak motivovat studenty k hlubšímu studiu a pochopení dané problematiky, jednak je více zapojit do přípravy aplikačních výstupů.
","","","","",Čeština,"",A,N,N,"","","",A,N,"",0,"",Mgr.,A,0,ZS,0,"","","",0,0,0
