zkratka,katedra,rok,nazev,nazevDlouhy,maVyuku,vyukaZS,vyukaLS,jakCastoJeNabizen,jakCastoJeNabizenUpresneni,kreditu,viceZapis,minObsazeni,garanti,garantiSPodily,garantiUcitIdno,prednasejici,prednasejiciSPodily,prednasejiciUcitIdno,cvicici,cviciciSPodily,cviciciUcitIdno,seminarici,seminariciSPodily,seminariciUcitIdno,schvalujiciUznani,schvalujiciUznaniUcitIdno,examinatori,examinatoriUcitIdno,podminujiciPredmety,vylucujiciPredmety,podminujePredmety,literatura,nahrazPredmety,metodyVyucovaci,metodyHodnotici,akreditovan,jednotekPrednasek,jednotkaPrednasky,jednotekCviceni,jednotkaCviceni,jednotekSeminare,jednotkaSeminare,anotace,typZkousky,maZapocetPredZk,formaZkousky,pozadavky,prehledLatky,predpoklady,ziskaneZpusobilosti,casovaNarocnost,predmetUrl,vyucovaciJazyky,poznamka,ectsZobrazit,ectsAkreditace,ectsNabizetUPrijezdu,poznamkaVerejna,skupinaAkreditace,skupinaAkreditaceKey,zarazenDoPrezencnihoStudia,zarazenDoKombinovanehoStudia,studijniOpory,praxePocetDnu,urovenNastavena,urovenVypoctena,automatickyUznavatZppZk,hodZaSemKombForma,semestr,pocetStudentu,aMax,bMax,cMax,aSkut,bSkut,cSkut
AFJ,KI,2024,Teorie automatů a formálních jazyků,Teorie automatů a formálních jazyků,A,A,N,K,"",5,NE,"","'doc. Ing. Mgr. Jiří Barilla, CSc.'","'doc. Ing. Mgr. Jiří Barilla, CSc.' (100)",449,"'doc. Ing. Mgr. Jiří Barilla, CSc.'","'doc. Ing. Mgr. Jiří Barilla, CSc.' (100)",449,"'doc. Ing. Mgr. Jiří Barilla, CSc.', 'RNDr. Jiří Škvor, Ph.D.'","'doc. Ing. Mgr. Jiří Barilla, CSc.' (100), 'RNDr. Jiří Škvor, Ph.D.' (100)","449, 2220","","","","","","","","","KI/AFJ1, KI/TAU","","'Chytil M. Automaty a gramatiky. SNTL, Praha, 1984. ',
'Hopocroft J., Ulman J. Introduction to Automata Theory, Languages and Computation. Addison Wesley, 1979. ',
'Chytil M. Teorie automatů a formálních jazyků. (Skripta), SPN Praha, 1978. ',
'Meduna A. Automata and Languages. Springer, 2000. ',
'Hopocroft J., Ulman J. Formálne jazyky a automaty. ALFA Bratislava, 1978. ',
'Kolář J., Štěpánková O., Chytil M. Logika, algebry a grafy. SNTL Praha, 1989. '","","","",N,2,HOD/TYD,2,HOD/TYD,0,HOD/TYD,"V tomto předmětu se studenti seznámí s teoretickými základy konečných automatů, gramatik a zásobníkových automatů. Důraz je kladen na propojení matematické teorie s praktickou realizací a využití dané teorie v současných technologiích. 
",Zkouška,ANO,Kombinovaná,zápočet písemnou formou s následnou ústní obhajobou,"1.	Konečné automaty (KA): reprezentace, jazyky rozpoznatelné konečnými automaty
2.	Redukce a realizace konečných automatu
3.	Nedeterministické konečné automaty
4.	Gramatiky: Chomského rozdělení gramatik, regulární gramatiky
5.	Regulární jazyky: uzávěrové vlastnosti, vztah ke KA
6.	Aplikace regulárních jazyků a automatů: regulární výrazy a jejich druhy
7.	Bezkontextové gramatiky
8.	Zásobníkové automaty
9.	Aplikace bezkontextových jazyků a zásobníkových automatů: LR/LL syntaktický analyzátor, ANTLR
10.	Turingovy stroje: modely a jejich vlastnosti
11.	Nerozhodnutelnost: Churchova-Turiingova teze, Postův korespondenční problém
12.	Ekvivalentní reprezentace Turingova stroje: RASP
13.	Praktické aplikace","","","","",Čeština,"",A,N,N,"","","",A,N,"",0,"",Bc.,A,"",ZS,0,"","",0,0,0,0
A192,KI,2024,Computational Geometry,Computational Geometry,A,A,A,K,"",2,NE,"","'RNDr. Jiří Škvor, Ph.D.'","'RNDr. Jiří Škvor, Ph.D.' (100)",2220,"'RNDr. Jiří Škvor, Ph.D.'","'RNDr. Jiří Škvor, Ph.D.' (100)",2220,"'RNDr. Jiří Škvor, Ph.D.'","'RNDr. Jiří Škvor, Ph.D.' (100)",2220,"","","","","","","","","","","",KI/0192,"","",A,1,HOD/TYD,1,HOD/TYD,0,HOD/TYD,"",Zápočet,NE,Kombinovaná,"","","","","","",Angličtina,"",A,N,N,"","","",N,A,"",0,"",Bc.,A,"",ZS,0,"","","",0,0,0
BP,KI,2024,Bakalářská práce z informatiky,Bakalářská práce z informatiky,A,A,A,K,"",12,NE,"","'doc. RNDr. Mgr. Viktor Maškov, DrSc.'","'doc. RNDr. Mgr. Viktor Maškov, DrSc.' (100)",2239,"","","","","","","","","","","","","","",KI/XBP1,"","",KI/BP1,"","",N,0,HOD/TYD,0,HOD/TYD,0,HOD/TYD,Cílem kurzu je zadání práce a kontrola postupu činnosti na závěrečné práci studenta.,Zápočet,NE,Kombinovaná,Zadání záv. práce a postup činnosti na záv. práci podle požadavků vedoucího práce.,"","","","","",Čeština,"",A,N,N,"","","",N,N,"",0,"",Bc.,A,"",ZS,0,"","","",0,0,0
BPP,KI,2024,Bakalářská práce,Bakalářská práce,A,A,A,K,"",12,NE,"","","","","","","","","","","","","","","","'prof. Sergii Babichev, DSc.', 'Mgr. Kamil Balín', 'doc. Ing. Mgr. Jiří Barilla, CSc.', 'Ing. Mgr. Pavel Beránek', 'Mgr. Jiří Fišer, Ph.D.', 'Ing. Petr Haberzettl', 'RNDr. Jan Krejčí, Ph.D.', 'Ing. Pavel Kuba, Ph.D.', 'RNDr. Petr Kubera, Ph.D.', 'doc. RNDr. Mgr. Viktor Maškov, DrSc.', 'doc. RNDr. Zbyšek Posel, Ph.D.', 'PhDr. Jiří Přibyl, Ph.D.', 'Mgr. Květuše Sýkorová', 'RNDr. Jiří Škvára, Ph.D.', 'RNDr. Jiří Škvor, Ph.D.'","3416, 1165, 449, 6973, 251, 1780, 2776, 2317, 650, 2239, 3521, 267, 835, 6259, 2220","","","","","","","",A,0,HOD/TYD,0,HOD/TYD,0,HOD/TYD,"",Zápočet,NE,Kombinovaná,"","","","","","",Čeština,"",A,N,N,"","","",A,A,"",0,"",Bc.,A,0,ZS,0,"","","",0,0,0
BP2O,KI,2024,Bakalářská práce,Bakalářská práce,A,A,A,K,"",6,NE,"","","","","","","","","","","","","","","","'prof. Sergii Babichev, DSc.', 'Mgr. Kamil Balín', 'doc. Ing. Mgr. Jiří Barilla, CSc.', 'Ing. Mgr. Pavel Beránek', 'Mgr. Jiří Fišer, Ph.D.', 'Ing. Petr Haberzettl', 'RNDr. Jan Krejčí, Ph.D.', 'Ing. Pavel Kuba, Ph.D.', 'RNDr. Petr Kubera, Ph.D.', 'doc. RNDr. Mgr. Viktor Maškov, DrSc.', 'doc. RNDr. Zbyšek Posel, Ph.D.', 'PhDr. Jiří Přibyl, Ph.D.', 'Mgr. Květuše Sýkorová', 'RNDr. Jiří Škvára, Ph.D.', 'RNDr. Jiří Škvor, Ph.D.'","3416, 1165, 449, 6973, 251, 1780, 2776, 2317, 650, 2239, 3521, 267, 835, 6259, 2220","","","","","","","",N,0,HOD/TYD,0,HOD/TYD,0,HOD/TYD,"Cílem kurzu je již vlastní práce na bakalářské práci. Úkoly nutné ke splnění tohoto předmětu určuje vedoucí bakalářské
práce a student je musí splnit pro zdárné splnění tohoto předmětu.
Vyžaduje se aktivní konzultace a spolupráce s vedoucím bakalářské práce a průběžné plnění jím zadaných úkolů.",Zápočet,NE,Kombinovaná,"Zápočet uděluje vedoucí práce po splnění zadaných úkolů, např. po zhodnocení vykonané práce a získaných výsledků.","","","","","",Čeština,"",A,N,N,"","","",A,A,"",0,"",Bc.,A,0,ZS,0,"","","",0,0,0
DP2O,KI,2024,Diplomová práce,Diplomová práce,A,A,A,K,"",10,NE,"","","","","","","","","","","","","","","","'prof. Sergii Babichev, DSc.', 'Mgr. Kamil Balín', 'doc. Ing. Mgr. Jiří Barilla, CSc.', 'Ing. Mgr. Pavel Beránek', 'Mgr. Jiří Fišer, Ph.D.', 'Ing. Petr Haberzettl', 'RNDr. Jan Krejčí, Ph.D.', 'Ing. Pavel Kuba, Ph.D.', 'RNDr. Petr Kubera, Ph.D.', 'doc. RNDr. Mgr. Viktor Maškov, DrSc.', 'doc. RNDr. Zbyšek Posel, Ph.D.', 'PhDr. Jiří Přibyl, Ph.D.', 'Mgr. Květuše Sýkorová', 'RNDr. Jiří Škvára, Ph.D.', 'RNDr. Jiří Škvor, Ph.D.'","3416, 1165, 449, 6973, 251, 1780, 2776, 2317, 650, 2239, 3521, 267, 835, 6259, 2220","","","","","","","",N,0,HOD/TYD,0,HOD/TYD,0,HOD/TYD,"Cílem kurzu je vlastní práce na diplomové práci. Úkoly nutné ke splnění tohoto předmětu určuje vedoucí diplomové práce a student je musí splnit pro zdárné splnění tohoto předmětu.
Vyžaduje se aktivní konzultace a spolupráce s vedoucím diplomové práce a průběžné plnění jím zadaných úkolů.",Zkouška,NE,Kombinovaná,"Zápočet uděluje vedoucí práce po splnění zadaných úkolů, např. po zhodnocení vykonané práce a získaných výsledků.","","","","","",Čeština,"",A,N,N,"","","",A,N,"",0,"",Mgr.,A,0,ZS,0,"","","",0,0,0
EDAV,KI,2024,Data Analysis and Visualisation,Data Analysis and Visualisation,A,A,A,K,"",9,NE,"","","","","'doc. RNDr. Zbyšek Posel, Ph.D.', 'Ricardo Rodriguez Jorge, Ph.D.', 'RNDr. Jiří Škvor, Ph.D.'","'doc. RNDr. Zbyšek Posel, Ph.D.' (100), 'Ricardo Rodriguez Jorge, Ph.D.' (100), 'RNDr. Jiří Škvor, Ph.D.' (100)","3521, 8514, 2220","'doc. RNDr. Zbyšek Posel, Ph.D.', 'Ricardo Rodriguez Jorge, Ph.D.', 'RNDr. Jiří Škvor, Ph.D.'","'doc. RNDr. Zbyšek Posel, Ph.D.' (100), 'Ricardo Rodriguez Jorge, Ph.D.' (100), 'RNDr. Jiří Škvor, Ph.D.' (100)","3521, 8514, 2220","","","","","","","","","","","","","","",N,3,HOD/TYD,3,HOD/TYD,0,HOD/TYD,"The course focuses on the presentation of information that are necessary to the basic and comprehensive evaluation of the data. Emphasis is placed on gaining the ability to visualize data by appropriate means. An integral part of the course is the practical application of theoretical knowledge on available data using appropriate software tools (typically Python, R, Matlab, Excel).",Zkouška,NE,Kombinovaná,"","","","","","",Angličtina,"",A,N,A,"","","",N,N,"",0,"","",A,0,ZS,0,"","","",0,0,0
ENME,KI,2024,Numerical Methods,Numerical Methods,A,A,A,K,"",7,NE,"","'prof. Sergii Babichev, DSc.'","'prof. Sergii Babichev, DSc.'",3416,"'prof. Sergii Babichev, DSc.', 'RNDr. Petr Kubera, Ph.D.', 'RNDr. Jiří Škvor, Ph.D.'","'prof. Sergii Babichev, DSc.' (100), 'RNDr. Petr Kubera, Ph.D.' (100), 'RNDr. Jiří Škvor, Ph.D.' (100)","3416, 650, 2220","'prof. Sergii Babichev, DSc.', 'RNDr. Petr Kubera, Ph.D.', 'RNDr. Jiří Škvor, Ph.D.'","'prof. Sergii Babichev, DSc.' (100), 'RNDr. Petr Kubera, Ph.D.' (100), 'RNDr. Jiří Škvor, Ph.D.' (100)","3416, 650, 2220","","","","","","","","","","","","","","",N,2,HOD/TYD,2,HOD/TYD,0,HOD/TYD,Introduction to numerical mathematics for students of computer science.,Zkouška,NE,Kombinovaná,"","","","","","",Angličtina,"",A,N,A,2/2 per week,"","",N,N,"",0,"","",A,0,ZS,0,"","","",0,0,0
EPDSA,KI,2024,Advanced Data Structures and Algorithms,Advanced Data Structures and Algorithms,A,A,N,K,"",7,NE,"","'prof. Sergii Babichev, DSc.'","'prof. Sergii Babichev, DSc.'",3416,"'prof. Sergii Babichev, DSc.'","'prof. Sergii Babichev, DSc.' (100)",3416,"'Mgr. Jiří Fišer, Ph.D.', 'doc. RNDr. Mgr. Viktor Maškov, DrSc.', 'RNDr. Jiří Škvor, Ph.D.'","'Mgr. Jiří Fišer, Ph.D.' (100), 'doc. RNDr. Mgr. Viktor Maškov, DrSc.' (100), 'RNDr. Jiří Škvor, Ph.D.' (100)","251, 2239, 2220","","","","","","","","","","","","","","",N,2,HOD/TYD,2,HOD/TYD,0,HOD/TYD,"The lectures focus on the formal description of algorithms and examples of their application in practice. In the course of the exercises, individual algorithms are implemented or their implementation in standard libraries is discussed (comparison of implementation efficiency) and their practical use is suggested.",Zkouška,NE,Kombinovaná,"Exam: preparation and oral defense of a seminar work (implementation of a non-trivial data structure or algorithm) + oral examination focusing on the practical use of algorithms and data structures in Python/R

Prerequisites: basics of procedural programming (loops, procedures), elementary data types (numbers, string, booleans), principles of efficient data representation (hashes, binary trees)
","1. Theoretical foundations of algorithmization: asymptotic complexity (Landau asymptotic notation), locality principle (implications for caches)
2. Data structures: basic principles, linear data structures, hash tables (hash functions), sparse arrays
3. Data structures: tree structures (binary ordered trees, heaps), tree balancing
4. Data structures: graphs (Fibonacci heaps, weighted graphs)
5. Recursive algorithms: divide and conquer (quick sort, merge sort, closest pair of points)
6. Recursive algorithms: dynamic programming
7. Greedy algorithms: deterministic greedy algorithms (e.g., finding the skeleton of a graph)
8. Greedy algorithms: heuristics (the traveling salesman problem)
9. Probabilistic algorithms: pseudo-random number generators, randomized data structures and classical algorithms, Monte Carlo methods
10. Computational geometry: convex hull, Delaunay triangulation, Voronoi diagram
11. Computational geometry: BSP tree, quadtree/octree and R-tree, Minkowski sum and its applications
12. Cluster analysis: hierarchical clustering, density clustering (DBSCAN), centroid clustering (k means), graph algorithms (cliques)
13. Text processing (suffix trees, string distance, approximate pattern matching)
","","","","",Angličtina,"",A,N,A,2/2 per week,"","",N,N,"",0,Mgr.,Mgr.,A,0,ZS,0,"","","",0,0,0
EPNUM,KI,2024,Advanced Numerical Methods,Advanced Numerical Methods,A,A,N,K,"",8,NE,"","'RNDr. Petr Kubera, Ph.D.'","'RNDr. Petr Kubera, Ph.D.'",650,"'RNDr. Petr Kubera, Ph.D.'","'RNDr. Petr Kubera, Ph.D.' (100)",650,"'doc. Ing. Mgr. Jiří Barilla, CSc.', 'RNDr. Jiří Škvor, Ph.D.'","'doc. Ing. Mgr. Jiří Barilla, CSc.' (50), 'RNDr. Jiří Škvor, Ph.D.' (50)","449, 2220","","","","","","","","","","","","","","",N,2,HOD/TYD,2,HOD/TYD,0,HOD/TYD,This course is an extension of the basic course of numerical methods with respect to numerical linear algebra and parts used in machine learning.,Zkouška,ANO,Kombinovaná,"Prerequisites: Basics from linear algebra (vectors, matrices, vector spaces) and analysis and basic principles of numerical method","1. Sources of numerical errors, the numerical stability of algorithms
2-3. System of linear equations, conditional number, Gaussian elimination 
LU factorization, Cholesky and QR factorization 
4-5. Iterative methods for the solution of linear algebraic equations: Jacobi method, Gauss-Seidel method, SOR, steepest descent method and conjugate gradient method.
6-7. Eigenvalues of the matrix: partial eigenvalues problem - power method, full eigenvalues problem QR iteration
8. Singular Value Decomposition ? SVD: computation and applications
9. Method for nonlinear equations, Newton's (Newton-Rhapson) method, fixed point method, etc.
10. Root finding for polynomials, Horner scheme
11. Principles of numerical quadrature: Newton-Cotes rules, Romberg's quadrature method, Gaussian quadrature rules, MC and adaptive methods
12. Principles of numerical solution of ODEs: one-step methods, Runge-Kutta methods, stiff system, stability, etc.
13. Function interpolation and approximation: Lagrange interpolation, cubic spline interpolation, Chebychev approximation

","","","","",Angličtina,"",A,N,A,2/2 per week,"","",N,N,"",0,Mgr.,Mgr.,A,0,ZS,0,"","","",0,0,0
EPYR,KI,2024,Python and R for Data Science,Python and R for Data Science,A,A,N,K,"",6,NE,"","'RNDr. Jiří Škvára, Ph.D.'","'RNDr. Jiří Škvára, Ph.D.'",6259,"'Ricardo Rodriguez Jorge, Ph.D.', 'RNDr. Jiří Škvára, Ph.D.', 'RNDr. Jiří Škvor, Ph.D.'","'Ricardo Rodriguez Jorge, Ph.D.' (100), 'RNDr. Jiří Škvára, Ph.D.' (100), 'RNDr. Jiří Škvor, Ph.D.' (100)","8514, 6259, 2220","'Ricardo Rodriguez Jorge, Ph.D.', 'RNDr. Jiří Škvára, Ph.D.', 'RNDr. Jiří Škvor, Ph.D.'","'Ricardo Rodriguez Jorge, Ph.D.' (100), 'RNDr. Jiří Škvára, Ph.D.' (100), 'RNDr. Jiří Škvor, Ph.D.' (100)","8514, 6259, 2220","","","","","","","","","","","","","","",A,1,HOD/TYD,2,HOD/TYD,0,HOD/TYD,"In the course, students will practically develop basic skills in programming languages Python and R in key areas for data engineers and scientists. Students will learn various methods and techniques of data processing, analysis and visualization purely practically on model solutions, i.e. at the application and interpretation level, without the need for deeper knowledge of the principles of these methods and techniques, which should be acquired in previous or next study. A significant part of the teaching is the work of students in groups on solving case studies (""inspired by data"") of a smaller scale, their presentation and mutual critical evaluation. Kaggle.com platforms are the source of data and inspiration. The materials of teaching platforms such as datacamp.com will be used in teaching, which are otherwise recommended especially for self-study and obtaining certificates.",Zkouška,NE,Kombinovaná,"Basics of programming in Python and R, basic knowledge of soft computing","1. Deepening the basics of syntax and basic constructions of Python and R languages
2. Basics of data manipulation and visualization
3. Intermediate data and data file manipulation (import, cleaning, etc.)
4. Intermediate data visualization
5. - 6. Exploratory analysis, selected advanced statistical methods (correlation, regression, factor, cluster analysis, etc.), inference statistics
7. - 8. Introduction to machine learning (selected classificators, regression and clusterring algorithms)
9. Introduction to natural language processing, sentiment analysis
10. Network analysis
11. - 12. Reports, dashboards and interactive data visualization
13. Summary, discussion on the assignment of seminar works
","","","","",Angličtina,"",A,N,N,1/2 per week,"","",N,N,"",0,"","",A,0,ZS,0,"","","",0,0,0
KAFJ,KI,2024,Teorie automatů a formálních jazyků,Teorie automatů a formálních jazyků,A,A,N,K,"",5,NE,"","'doc. Ing. Mgr. Jiří Barilla, CSc.'","'doc. Ing. Mgr. Jiří Barilla, CSc.' (100)",449,"'doc. Ing. Mgr. Jiří Barilla, CSc.'","'doc. Ing. Mgr. Jiří Barilla, CSc.' (100)",449,"'doc. Ing. Mgr. Jiří Barilla, CSc.', 'RNDr. Jiří Škvor, Ph.D.'","'doc. Ing. Mgr. Jiří Barilla, CSc.' (100), 'RNDr. Jiří Škvor, Ph.D.' (100)","449, 2220","","","","","","","","","","","'Chytil M. Automaty a gramatiky. SNTL, Praha, 1984. ',
'Hopocroft J., Ulman J. Introduction to Automata Theory, Languages and Computation. Addison Wesley, 1979. ',
'Chytil M. Teorie automatů a formálních jazyků. (Skripta), SPN Praha, 1978. ',
'Meduna A. Automata and Languages. Springer, 2000. ',
'Hopocroft J., Ulman J. Formálne jazyky a automaty. ALFA Bratislava, 1978. ',
'Kolář J., Štěpánková O., Chytil M. Logika, algebry a grafy. SNTL Praha, 1989. '","","","",N,6,HOD/SEM,6,HOD/SEM,2,HOD/SEM,"V tomto předmětu se studenti seznámí s teoretickými základy konečných automatů, gramatik a zásobníkových automatů. Důraz je kladen na propojení matematické teorie s praktickou realizací a využití dané teorie v současných technologiích. 

",Zkouška,ANO,Kombinovaná,"Požadavky pro udělení zápočtu
- aktivní účast na přednáškách a cvičeních (povoleno je nejvýše 5 absencí)
- absolvování dvou testů se ziskem alespoň 50 procent bodů z možných

Zkouška je ústní a proběhne v časovém rozsahu zhruba 30 minut. Slouží k prověření teoretických znalostí, jako jsou definice základních pojmů, formulace stěžejních vět a vysvětlení vybraných algoritmů.","1.	Konečné automaty (KA): reprezentace, jazyky rozpoznatelné konečnými automaty
2.	Redukce a realizace konečných automatu
3.	Nedeterministické konečné automaty
4.	Gramatiky: Chomského rozdělení gramatik, regulární gramatiky
5.	Regulární jazyky: uzávěrové vlastnosti, vztah ke KA
6.	Aplikace regulárních jazyků a automatů: regulární výrazy a jejich druhy
7.	Bezkontextové gramatiky
8.	Zásobníkové automaty
9.	Aplikace bezkontextových jazyků a zásobníkových automatů: LR/LL syntaktický analyzátor, ANTLR
10.	Turingovy stroje: modely a jejich vlastnosti
11.	Nerozhodnutelnost: Churchova-Turiingova teze, Postův korespondenční problém
12.	Ekvivalentní reprezentace Turingova stroje: RASP
13.	Praktické aplikace","","","","",Čeština,"",A,N,N,"","","",N,A,"",0,"",Bc.,A,"",ZS,0,"","",0,0,0,0
KMIS,KI,2024,Podnikový management a IS,Podnikový management a informační systémy,A,A,N,K,"",5,NE,"","'RNDr. Jiří Škvor, Ph.D.'","'RNDr. Jiří Škvor, Ph.D.' (100)",2220,"'RNDr. Jiří Škvor, Ph.D.', 'Ing. Štěpánka Zimová'","'RNDr. Jiří Škvor, Ph.D.' (100), 'Ing. Štěpánka Zimová' (100)","2220, 7352",'Ing. Štěpánka Zimová','Ing. Štěpánka Zimová' (100),7352,"","","","","","","","","",KI/KFIS,"'SYNEK, M. Manažerská ekonomika. Praha: Grada, 2007. ISBN 978-80-247-1992-4.',
'Synek M. a kol. Podniková ekonomika. C. H. Beck, Praha, 2006. ISBN 80-7179-892-4.',
'Schelle K. Právo pro ekonomy. Key Publishing, Ostrava, 2011. ISBN 978-80-7418-115-3.',
'Spirit M. Základy práva pro neprávníky. Vydavatelství a naklad. Aleš Čeněk, Plzeň, 2012. ISBN 978-80-7380-391-9.',
'Kislingerová E. Inovace nástrojů ekonomiky a managementu organizací. C. H. Beck, Praha, 2008. ISBN 978-80-7179-882-8.',
'Švarc Z. Základy obchodního práva. Vydavatelství a nakladatelství Aleš Čeněk, Plzeň, 2011. ISBN 978-80-7380-322-3.',
'Mates P. Základy teorie práva. Oeconomica, Praha, 2009. ISBN 978-80-245-1566-3.'","","","",N,6,HOD/SEM,6,HOD/SEM,0,HOD/SEM,"Cílem přednášek je poskytnout studentům přehled o principech, které ovlivňují především podnikatelské prostředí, fungování a vztahy právnických a fyzických osob. Způsob výstavby společnosti, její ekonomické fungování s důrazem na základní principy účetnictví, výkaznictví a důležitých indexů tvořící základ fungování současných informačních systémů.Cílem seminářů je objasnění základních stavebních prvků podniku, jeho financování, řízení, získávání informací o jeho okolí. Součástí semináře je i úvod do problematiky standardizace v oblasti informatiky.",Zkouška,ANO,Kombinovaná,"","1. Podnik a podnikání, Efektivnost podniku a její základní kategorie, Cíle podniku a jeho funkce
2. Management a jeho funkce, rozhodování, plánování, organizace, koordinace
3. Řízení lidských zdrojů, výrobní a nákupní činnosti podniku, financování podniku
4. Obecný úvod do právního systému (základní pojmy práva, dělba moci, organizace výkonu práva a síla právní normy)
5. Živnostenský zákon (definice živnosti, rozdělení živností, podmínky provozování živností, druhy živností, živnostenský rejstřík, živnostenské oprávnění)
6. Občanský zákoník (rozsah působnosti, vymezení pojmů, struktura a vybrané části obč. zák.), obchodní zákoník (rozsah působnosti, definice podnikání, podnik a obchodní jmění, obchodní rejstřík, obchodní společnosti a družstvo, pojmenované a nepojmenované smlouvy).
7. Zákoník práce (předmět úpravy ZP, účastníci pracovně právních vztahů, kolektivní smlouva, pracovní poměr, pracovní smlouva, změny pracovního poměru, skončení pracovního poměru, dohody o pracích konaných mimo pracovní poměr, pracovní doba a doba odpočinku, odměňování za práci, poskytování cestovních náhrad)
8. Majetková a kapitálová výstavba podniku, zdroje financování
9. Organizační struktura podniku, podnikové řízení, firemní kultura
10. Investiční činnost a podnikové početnictví
11. Zdroje informací o právních normách, podnikatelský plán
12. okolí společnosti a využití metod Competitive Intelligence
13. Standardy v oblasti informačních systémů","","","","",Čeština,"",A,N,N,"","","",N,A,"",0,"",Bc.,A,"",ZS,0,"","","",0,0,0
KNME,KI,2024,Numerické metody,Numerické metody,A,A,N,K,"",5,NE,"","'doc. RNDr. Mgr. Viktor Maškov, DrSc.'","'doc. RNDr. Mgr. Viktor Maškov, DrSc.'",2239,"'RNDr. Petr Kubera, Ph.D.', 'doc. RNDr. Mgr. Viktor Maškov, DrSc.', 'RNDr. Jiří Škvor, Ph.D.'","'RNDr. Petr Kubera, Ph.D.' (100), 'doc. RNDr. Mgr. Viktor Maškov, DrSc.' (100), 'RNDr. Jiří Škvor, Ph.D.' (100)","650, 2239, 2220","'RNDr. Petr Kubera, Ph.D.', 'doc. RNDr. Mgr. Viktor Maškov, DrSc.', 'RNDr. Jiří Škvor, Ph.D.'","'RNDr. Petr Kubera, Ph.D.' (100), 'doc. RNDr. Mgr. Viktor Maškov, DrSc.' (100), 'RNDr. Jiří Škvor, Ph.D.' (100)","650, 2239, 2220","","","","","","","",KMA/K111,"","","'Felcman J. Numerická matematika. 2013. ',
'Segethova, J. Základy numerické matematiky. Karolinum, Praha. ',
'Mathematics. Springer, Berlin. ISBN 0-387-98959-5.',
'Ueberhuber, W. Numerical Computation 1, 2: Methods, Software, and Analysis. Springer, Berlin. ',
'Quarteroni, A., Sacco, R., and Saleri, F. Numerical Mathematics (2ndedn), Volume 37 of Texts in Applied Mathematics. Springer, Berlin. ISBN 0-387-98959-5. '","","","",N,6,HOD/SEM,6,HOD/SEM,0,HOD/SEM,Základní kurs numerické matematiky pro informatiky.,Zkouška,ANO,Kombinovaná,"Požadavky pro udělení zápočtu
- aktivní účast na seminářích
- prezentace řešení vybraných úloh ve vhodném programovacím jazyce a jejich vysvětlení

Zkouška je ústní a proběhne v časovém rozsahu zhruba 30 minut. Prověřovány jsou teoretické znalosti a schopnost popisu, rozboru a odvození vybraných algoritmů.","1.	Aproximace funkcí v R, Lagrangeův interpolační polynom, chyba Lagrangeovy interpolace. 
2.	Kubický spline, konstrukce přirozeného kubického spline. 
3.	Numerická integrace funkcí, Newtonovy-Cotesovy vzorce, složené Newtonovy-Cotesovy vzorce. 
4.	Rombergova kvadratura, Gaussova kvadratura. 
5.	Metody řešení nelineárních rovnic, Newtonova metoda, důkaz konvergence Newtonovy metody. 
6.	Metoda postupných aproximací pro nelineární rovnice, kořeny polynomu, Hornerovo schéma. 
7.	Soustavy lineárních rovnic, podmíněnost matic, Gaussova eliminace, pivotace, Gaussova eliminace jako faktorizační metoda. 
8.	LU rozklad, vliv zaokrouhlovacích chyb, Choleského rozklad, QR rozklad. 
9.	Iterační metody řešení soustav lineárních algebraických rovnic, klasické iterační metody. 
10.	Výpočet vlastních čísel matic, mocninná metoda. 
11.	Numerická integrace obyčejných diferenciálních rovnic, jednokrokové metody, metody typu Runge-Kutta, Rungeova-Kuttova metoda 2. řádu. 
12.	Gradientní metody.",Výuka v angličtině je určena pro erasmové a zahraniční studenty. Výuka v případě malého počtu studentů probíhá formou individuálních konzultací.,"","","","Čeština, Angličtina",Výuka v anglickém jazyce je určena výhradně studentům přijíždějícím v rámci programu Erasmus.,A,N,N,"","","",N,A,"",0,"",Bc.,A,"",ZS,0,"","",0,0,0,0
