katedra,zkratka,idno,typAkceZkr,rok,datumOd,datumDo,hodinaSkutOd,hodinaSkutDo,identifier,katedra_right,nazev,seminarici,seminariciUcitIdno,jmena
KCH,BK308,4226,Se,2024,20.12.2024,20.12.2024,09:00,12:50,BK308KCH,KCH,Odborný seminář B,"'doc. Ing. Jan Čermák, CSc.'",1064,"Kadlečková Ivana, Ing."
KCH,BK320,9475,Se,2024,6.12.2024,6.12.2024,10:00,13:50,BK320KCH,KCH,Seminář z průmyslové chemie,"'doc. Ing. Jaromír Lederer, CSc.'",1543,"Šimek Josef, Ing. Ph.D."
KBI,KRSP,8952,Se,2024,2.11.2024,2.11.2024,09:00,12:50,KRSPKBI,KBI,Komplexní reflektivní seminář praxe,"'doc. PhDr. Kateřina Jančaříková, Ph.D.'",8441,"Svobodová Silvie, PhDr. Ing. Ph.D."
KBI,KRSP,8952,Se,2024,14.12.2024,14.12.2024,09:00,12:50,KRSPKBI,KBI,Komplexní reflektivní seminář praxe,"'doc. PhDr. Kateřina Jančaříková, Ph.D.'",8441,"Svobodová Silvie, PhDr. Ing. Ph.D."
KBI,KRSP,8952,Se,2024,16.11.2024,16.11.2024,09:00,12:50,KRSPKBI,KBI,Komplexní reflektivní seminář praxe,"'doc. PhDr. Kateřina Jančaříková, Ph.D.'",8441,"Svobodová Silvie, PhDr. Ing. Ph.D."
KFY,PPP,301,Se,2024,4.10.2024,3.1.2025,09:00,11:50,PPPKFY,KFY,Průběžná pedagogická praxe,"'RNDr. Jiří Králík, Ph.D.'",303,"Hejnová Eva, RNDr. Ph.D."
